"HD3877";"3664944000846";"25/11/2020";"https://productlive.blob.core.windows.net/import/98b997ea3c7b44af3e162b55a3c4dbc2c56304a7/HD3876-HD3877-HD3878-HD3879-HD3880_NOTICE_2018%2003%2028.pdf";"https://asset.product-live.com/7c55a57ae856bf24612ca0db3f2723b8050561fd.jpg";"https://asset.product-live.com/055b83a87cc688193f7ae82763c851e09cb20cb3.jpg";"";"";"";"";"https://asset.product-live.com/6a5e04943edce3e6c5ab03ddaa4354d445f3bc3b.jpg";"https://asset.product-live.com/f23e463ad9f53d924728bf28fe8ae183e2d9d1cb.jpg";"https://asset.product-live.com/8f5895970c9656e4b7b264505928c41e9d26b103.jpg";"https://asset.product-live.com/a197813e86199201608f74ef9ce3c41c27c63ad2.jpg";"https://asset.product-live.com/e743ab9b0816b2a6b03420550ac5627b81a97b6d.jpg";"https://asset.product-live.com/8dfb0fce20c6dddaceb9c32acf9c17b2de02c32e.jpg";"https://asset.product-live.com/b2009ac290a7643c8beebea17d15f7919c07bbed.jpg";"";"";"";"Modernisez une pièce de la maison avec ce beau duo de tables gigognes entièrement réalisées en bois ! Les motifs ethniques présents sur les plateaux ronds apporteront un effet graphique à votre ambiance ! Détail : 4 pieds bicolores - Dimensions : 43x43x48 cm - 33x33x40 cm.";"Modernize a room of the house with this beautiful pair of nesting tables entirely made of wood! The ethnic motifs on the round trays will bring a graphic effect to your atmosphere! Detail: 4 bi-colored feet - Dimensions: 43x43x48 cm - 33x33x40 cm.";"";
"HD3692";"3664944000389";"20/11/2020";"https://prodstoragevazc.blob.core.windows.net/import/d546bc2dae0baa29a7042d3aa435cfb273a9c21d/HD3691_HD3692_HD3693_HD3694_HD3695_NOTICE_2018%2001%2010.pdf";"https://asset.product-live.com/a3dcdb14d6eb8ce9a4299993d45bee17c59bc5c8.JPG";"";"https://asset.product-live.com/641d2cac8d5e89e58c4750597237a3d9ffd17d54.jpg";"";"";"";"https://asset.product-live.com/2c8ef9582e356b33bb93868a4dd9537445ac252a.JPG";"https://asset.product-live.com/6b2f8f76f59af3168ea0f2a06a0af3fd53b06d06.jpg";"https://asset.product-live.com/ec66b3a2cf6daf06306e7ab99dba8ccc12d0cf48.JPG";"https://asset.product-live.com/765ff7c6254d69a48dcf029c56cca5558d099604.JPG";"https://asset.product-live.com/9860c231b19fd49d9182610b38d111a12d1b4f36.JPG";"https://asset.product-live.com/d54dd05c3de134c320ee9388979c971ec07b7785.JPG";"";"";"";"";"Ce petit coffre au revêtement effet velours vous séduira à coup sûr ! Il apportera beaucoup de cachet dans votre intérieur et vous pourrez y ranger vos petites affaires. Le modèle est monté sur 4 pieds en bois et se ferme à l'aide d'un fermoir métallique. Détail : Hauteur d'assise 40 cm - Test assise 110 kg - Dimensions : 40x33.5x40 cm.";"";"";
"HD3878";"3664944000853";"25/11/2020";"https://productlive.blob.core.windows.net/import/9bd3e55edd217f5afe9832d12c69882400d7fbc1/HD3876-HD3877-HD3878-HD3879-HD3880_NOTICE_2018%2003%2028.pdf";"https://asset.product-live.com/a91a4490964c8a0f575df23b8ec653b02fc55848.jpg";"https://asset.product-live.com/a568aedf4ede91f14d6699d4c67d6ace06eaf3fd.jpg";"";"";"";"";"https://asset.product-live.com/e4b3953c7e97857972b14fb172861b55d1b133e1.jpg";"https://asset.product-live.com/23a62b65f4639b296bbe1ff55f53aa5998f1cc46.jpg";"https://asset.product-live.com/387e6681be4dcc7f3520e276cee3a4b94360315a.jpg";"https://asset.product-live.com/4b4fc72cc85b3d94a511c3c729a95da67d6bfb34.jpg";"https://asset.product-live.com/aa44b4837399cd5a97d8969a9e6c280a9a169568.jpg";"https://asset.product-live.com/a9b8379ae0aae0a096eccbd137c23f10b24f4c23.jpg";"https://asset.product-live.com/2fc3097274c7c77763d89b6393dfa95b3d6f36e4.jpg";"";"";"";"Modernisez une pièce de la maison avec ce beau duo de tables gigognes entièrement réalisées en bois ! Les motifs géométriques présents sur les plateaux ronds apporteront un effet graphique à votre ambiance ! Détail : 4 pieds bicolores - Motif : Fleur - Pois - Dimensions : 43x43x48 cm - 33x33x40 cm.";"";"";
"HD3879";"3664944000860";"25/11/2020";"https://productlive.blob.core.windows.net/import/8f7664f85d2db7475e8852c0c2b220b141e30092/HD3876-HD3877-HD3878-HD3879-HD3880_NOTICE_2018%2003%2028.pdf";"https://asset.product-live.com/df2617ea66066a2ba0b745cd598cebb9e0f119b4.jpg";"https://asset.product-live.com/61be316317625cc73dab93212424a91c007119f7.jpg";"";"";"";"";"https://asset.product-live.com/e47d2d59a375d7364e7b759aa4d46f49b639b038.jpg";"https://asset.product-live.com/a32a0751ff3a26c93defa8a9858179ebb55c93f2.jpg";"https://asset.product-live.com/5413a3b1b32d0770404c3d92647204f13ceee56a.jpg";"";"https://asset.product-live.com/a488cee3413aa09bcde98321c59393fe3a42a127.jpg";"https://asset.product-live.com/e03f1f0339bc0d55b053fddaec1d74e80f340499.jpg";"https://asset.product-live.com/a0e3b63c04bf797eed893e509284c6840b038eb4.jpg";"";"";"";"Modernisez une pièce de la maison avec ce beau duo de tables gigognes entièrement réalisées en bois ! Les motifs de losanges présents sur les plateaux ronds apporteront un effet graphique à votre ambiance ! Détail : 4 pieds bicolores - Dimensions : 43x43x48 cm - 33x33x40 cm.";"";"";
"HD3880";"3664944000877";"30/11/2020";"https://productlive.blob.core.windows.net/import/14178af49c707b52f9162990edbe2bbb48814b22/HD3876-HD3877-HD3878-HD3879-HD3880_NOTICE_2018%2003%2028.pdf";"https://asset.product-live.com/a4caffdc1ad0a7ac654d70466a1ce426ded1a166.jpg";"https://asset.product-live.com/8051d9211c29b418f237ab70237597743c37c953.jpg";"";"";"";"";"https://asset.product-live.com/ff059b6923ae54c22504f4954150ca56aee52c7a.jpg";"https://asset.product-live.com/81024b8525bdfd4e866efe8b0b425fa317cb5dba.jpg";"https://asset.product-live.com/4c98fbaae43f992b568e966891b07c0ce749e5cf.jpg";"https://asset.product-live.com/dd7d6a87c5d46c1a89c61083ee8bc26f721f3fd7.jpg";"https://asset.product-live.com/dfcb87c80b03b1d36162df5fa643c663024e3db6.jpg";"https://asset.product-live.com/915128df953d7b4e6e8ccc12ba56ce063b4a79fb.jpg";"";"";"";"";"Modernisez une pièce de la maison avec ce beau duo de tables gigognes entièrement réalisées en bois ! Les motifs de carreaux présents sur les plateaux ronds apporteront un effet graphique à votre ambiance ! Détail : 4 pieds bicolores - Dimensions : 43x43x48 cm - 33x33x40 cm.";"";"";
"HD3667";"3664944000884";"20/11/2020";"https://productlive.blob.core.windows.net/import/4cb9736548a29f130862a3141e0f0f070ca7d813/HD3666-HD3667-HD3668-HD3669-HD3670-HD3671_NOTICE_2018%2001%2022.pdf";"https://asset.product-live.com/5037ce878fd356cf746b9079dd5cfae652839f7d.jpg";"https://asset.product-live.com/6229e651e5a108e20610db78ff2b1c810fd9a3c2.jpg";"https://asset.product-live.com/26c51832fc99d872aad3a2f206716ab364f9c2cb.jpg";"";"";"";"https://asset.product-live.com/42fccdc04a3689660f8a578d7c697a18074cc7df.jpg";"https://asset.product-live.com/e93d9a931997336e82f9c0b880509e3085de4ed2.jpg";"https://asset.product-live.com/40dfec0377a6f08a09206ecfd5b528b51a814a1d.jpg";"";"https://asset.product-live.com/d024515594c9c94b1bcaeab8996a58313a995d71.jpg";"";"";"";"";"";"Vous appréciez le retour du vintage ? Vous craquerez pour le design épuré et résolument chic de cette chaise imitation velours. Le modèle présente 4 pieds métalliques bicolores ainsi qu'un jeu de motifs d'alvéoles à l'arrière. Détail : Hauteur d'assise 47 cm.";"";"";
"HD3882";"3664944001218";"25/11/2020";"https://productlive.blob.core.windows.net/import/2b0717f40b2f32fd026411a7a1832cff5f158963/HD3881-HD3882_NOTICE_2018%2001%2025.pdf";"https://asset.product-live.com/51a0ca77098cc8c3c5d8fb79ff7b6b5e80b41889.jpg";"https://asset.product-live.com/3afd975f76ba27633196254255d9f5c9cce43a56.jpg";"https://asset.product-live.com/fdc4ca6b7388af30f81f515671b554367877d87c.jpg";"";"";"";"https://asset.product-live.com/1a29c741a6c9d29992a2b0cff3f4718d1f12624f.JPG";"https://asset.product-live.com/393be859fc23906062d35b4ac0774274f7c8ef59.JPG";"https://asset.product-live.com/5807f853da2ee550a865d8a054e54623dc341b0a.JPG";"https://asset.product-live.com/6f1ae3eccfdf8a8d625d29b49e8cd72e3b04e2c2.JPG";"https://asset.product-live.com/8753c9e808bf5c2bee1e80d489650c9ab2bed243.JPG";"";"";"";"";"";"Vous ne trouvez pas la table basse idéale ? Découvrez ce modèle 3en1 qui offre plusieurs choix ! Modulez-le en fonction de vos besoins et composez un seul module, ou deux et puis 3 ! L'ensemble est réalisé avec un beau plateau en bois qui tient sur des pieds métalliques, un mélange élégant et dans l'air du temps ! Détail : Lot de 3.";"";"";
"HD3881";"3664944001089";"01/12/2020";"https://productlive.blob.core.windows.net/import/714e5238dac04364a2d73b4c558f0898bcd37107/HD3881-HD3882_NOTICE_2018%2001%2025.pdf";"https://asset.product-live.com/c714045dd6648ebd62e94ffe46bda872e82e4d8e.jpg";"";"https://asset.product-live.com/3444de2aabdafdffeb53bd2e6a7cdea7eff93f41.jpg";"";"";"";"https://asset.product-live.com/8f6408fcb002737619bf1e73182a7e4d4875c47e.JPG";"https://asset.product-live.com/9fcb522c807b39614324d89f284bb5a8f9b0b575.JPG";"https://asset.product-live.com/c3bb69e41dd2a76b33fe04431da6a69140f500f9.JPG";"https://asset.product-live.com/d0dfb93ed81a69c83ddb93758b9d4de56b931381.JPG";"";"";"";"";"";"";"Vous ne trouvez pas la table basse idéale ? Découvrez ce modèle 3en1 qui offre plusieurs choix ! Modulez-le en fonction de vos besoins et composez un seul module, ou deux et puis 3 ! L'ensemble est réalisé avec un beau plateau en bois qui tient sur des pieds métalliques, un mélange élégant et dans l'air du temps ! Détail : Lot de 3.";"Can not find the ideal coffee table? Check out this 3in1 model that offers several choices! Modulate it according to your needs and compose a single module, or two and then 3! The set is made with a beautiful wooden tray that stands on metal feet, a stylish mix and in tune with the times! Detail: Lot of 3.";"";
"KA2698";"3561869026985";"01/12/2020";"";"https://asset.product-live.com/d6af9908c51033468758145f4059557c9a8a2c90.jpg";"https://asset.product-live.com/6db196498a4a72627a4be55f8591b81f68f6d727.jpg";"";"https://asset.product-live.com/c11d87f93e75b2c1b5cab226d92389c50f421bd1.JPG";"";"";"https://asset.product-live.com/aa45d07a1e90754b0dde9d2f5564b934886e2eba.jpg";"https://asset.product-live.com/c382d8a4dfe582133e8798d2ec24ba52a67800e4.jpg";"";"";"";"";"";"";"https://asset.product-live.com/28af2bbcb36cd64ecbe6aa3c613da25f468f13a7.png";"";"Organisez et personnalisez vos soirées ou simples apéros entre amis grâce à ce lot de 4 mason jar superbement mis en valeur dans un présentoir en forme de paillote. Vous pourrez siroter avec plaisir vos cocktails à l'aide des pailles réutilisables prévues à cet effet, vos convives vont adorer vos réceptions ! Contenance 40 cl.";"Organize and personalize your evenings or simple aperitifs with friends thanks to this lot of 4 mason jar superbly highlighted in a hut-shaped display. You can sip your cocktails with pleasure using the reusable straws provided for this purpose, your guests will love your receptions! Capacity 40 cl.";"";
"LA9936";"3664944002284";"11/11/2020";"https://productlive.blob.core.windows.net/import/c44b2ae57f37743d2b5fbcfb32daa3eb75ebf908/LA9936-PDF.pdf";"https://asset.product-live.com/76bb362710d91c7f1202029b1dd47db29a77e0b1.jpg";"https://asset.product-live.com/a884906df8ad3da524fde667eccbf234d3833741.jpg";"";"https://asset.product-live.com/00a82c73881f4d9191c6616b6543fde5bc718768.jpg";"";"";"https://asset.product-live.com/63309fb189ca9edbb4eca6bc23eb2654365c8499.jpg";"https://asset.product-live.com/be104fd8bc88782dee8d824db3d851e9ee00442e.jpg";"https://asset.product-live.com/1683139cc0e1409e66fe9c7c2be4c083038da2a0.jpg";"";"";"";"";"";"https://asset.product-live.com/60c3c11fb973d49e5bbc001653d255b689542602.png";"";"Mettez de l'animation sur votre maison durant les fêtes ! Ce projecteur vidéo à tête inclinable offre 2 thèmes et 8 vidéos enregistrées pour une décoration pleine de fantaisie à Nöel et pendant Halloween. Il vous suffira de projeter depuis l'intérieur sur l'une des fenêtres pour que les vidéos soient visibles à l'extérieur, succès garanti ! Détail : Durée maximale des vidéos 30 secondes - Voilage et fixations inclus.";"";"";
"HD3499";"3664944001768";"01/12/2020";"https://productlive.blob.core.windows.net/import/dd319d4fa5757955694bc5302e4b2bf0b6f268e2/HD3499_NOTICE_2018%2001%2030.pdf";"https://asset.product-live.com/4875d88fa0c26b2f219ac2c7147becfe0816252d.jpg";"https://asset.product-live.com/10152ba3ed1cc18bd2292c75d72af733f8b6df9c.jpg";"";"";"";"";"https://asset.product-live.com/a992f17fea5c50797da93d0581c09ce4bd0fd652.jpg";"https://asset.product-live.com/77678bdd707fee813a66784d213a90347b8f1f98.jpg";"https://asset.product-live.com/c4d46da8a249f115c024f9ede847fc86e8a09c8f.jpg";"https://asset.product-live.com/b0857aef3d9c1a3e8913e4207ea0d3bec0b1db03.jpg";"";"";"";"";"";"";"Créez une atmosphère typiquement contemporaine et nordique dans votre salle à manger avec cette chaise de bar montée sur 4 beaux pieds en bois brut ! Vous serez sans l'ombre d'un doute séduit par le confort de son assise rembourrée et de son dossier rigide. Dimensions : 56x105x48 cm - Hauteur d'assise : 70.5 cm.";"Create a contemporary, Scandinavian atmosphere in your dining room with this tall bar stool! Sizes : 48x56.3x106 cm - Seat height: 70.5 cm";"";
"KA2956";"3664944049975";"20/11/2020";"";"https://asset.product-live.com/2409f0d8fd9d1b7abda95e787ea310d7938165ab.jpg";"https://asset.product-live.com/72030b5165f9ff368b513195da6a78614d88796c.jpg";"";"https://asset.product-live.com/0a4a8feb6612a1a6f494ed477031cb75ccc5212a.jpg";"";"";"https://asset.product-live.com/d740e30e4617bc8bb4ec1ec81746b1f55b685c34.jpg";"https://asset.product-live.com/74e1461cfbf00e7f934f4ee1450e9cbd2a4e1038.jpg";"";"";"";"";"";"";"https://asset.product-live.com/db3ac56d03ddd6a804a7d8f91d731b40130638f1.png";"";"Rangez avec style les accessoires de cuisine sur ce support murale réalisé en bois et en métal. Son design industriel apportera du cachet dans votre cuisine tout en vous permettant de profiter d'un plateau principal, de 2 compartiments et de 4 crochets. Il ne vous reste plus qu'à le fixer au mur ! Détail : Visserie non incluse - Dimensions : 46x31.5x15.3 cm.";"";"";
"LA12033";"3664944048589";"01/12/2020";"https://prodstoragevazc.blob.core.windows.net/import/fede9ee8060256ba8946ee0256d124edd50132a9/LA12033_IM_2018-07-12.docx";"https://asset.product-live.com/8798f3b073d32a27391c75ca77ce228dbfd3d5a7.jpg";"https://asset.product-live.com/2e17177256cd1f457d3d8331f20f7bd6585c4e98.jpg";"https://asset.product-live.com/ddd57bdfc4fc1ccbe0f8aa7a719b3f95ae373447.jpg";"https://asset.product-live.com/cd9cca91929e763b83724b8a024ad1ae056ad69c.jpg";"https://asset.product-live.com/350cf77d03ffd4760aec983be7f28613fda456fe.jpg";"";"https://asset.product-live.com/ea084612f5e7ab229e8e626327d51b5c73df0d77.jpg";"https://asset.product-live.com/7daec6641ffbff45d6c3ad3d294f8828d12ea0e0.jpg";"https://asset.product-live.com/83795b695f59abfd6087753c8b25aafc71b046e4.jpg";"https://asset.product-live.com/d4dd6acce86c27bfa1adbca0659a328241b931c5.jpg";"https://asset.product-live.com/d3c71f1c33441f8a1ceb2d16a1b556f88eb7401b.jpg";"";"";"";"";"";"Les mason jar ont le vent en poupe ! Cette superbe suspension à 4 bocaux sera l'atout charme de votre coin cuisine. Découvrez sans plus tarder ses finitions ! Détail : Câbles tressés en noir et blanc, longueur 95 cm - Dimensions des bocaux : 9.5x17 cm - Dimensions support en bois : 80x10x4 cm - Dimensions barre : 70x12x3.5 cm - Ampoule 4 x E27 max 10 W non incluses - Alimentation sur secteur - Entrée : 220-240V AC 50Hz.";"";"";
"LA12036";"3664944048596";"30/11/2020";"https://prodstoragevazc.blob.core.windows.net/import/deb0d1a3f2101f066ce580c29afa7e8ad4586965/LA12036%20%20LA12037%20ASSEMBLE%20MANUAL%20..pdf";"https://asset.product-live.com/1a7c0156a293c698358bb06febb68f20be7b25fb.jpg";"https://asset.product-live.com/707e3c0f2fb0400303c4517120648b69bcf7515e.jpg";"https://asset.product-live.com/d4322ec3700ecfe5552339058eb1063b9ed55aca.jpg";"";"https://asset.product-live.com/586ce0e26526b23a69ac37b234db4a02ca7faafa.jpg";"";"https://asset.product-live.com/ac200e72ea676d6cd81cd388c2f5892083c0f82a.jpg";"";"";"";"";"";"";"";"";"";"Créez une déco tendance digne des célèbres plateaux de cinéma avec ce lampadaire bicolore réalisé en métal et en bois. Vous apprécierez sa tête orientable ainsi que le parfait équilibre de son trépied. Pensez à le moduler pour l'adapter au mieux à vos besoins avant d'opter pour l'ampoule de votre choix, il sera incontestablement l'atout charme de votre déco ! Détail : Longueur de câble 2.20 m - Hauteur maximale du luminaire 1.50 m - Dimensions de l'abat jour 30x30 cm - Fonctionne avec une ampoule E27 10 W max non incluse.";"";"";
"LA12037";"3664944048602";"01/12/2020";"https://prodstoragevazc.blob.core.windows.net/import/6b5235b15314ddd876777be2f2d340d1865c0518/LA12036%20%20LA12037%20ASSEMBLE%20MANUAL%20..pdf";"https://asset.product-live.com/0903d2cae0ba669d6794d749513ed33bec12ec71.jpg";"https://asset.product-live.com/5a839ae58edbc8322a23f5c98e34fa65d515ed99.jpg";"https://asset.product-live.com/bf2a25a421ae5ea42194ca028b3b990974efcf1a.jpg";"";"https://asset.product-live.com/d94ac0813bad55db82b272fe14d7e18b801884eb.jpg";"";"https://asset.product-live.com/28cef503f2501419fc16699d9e9e28dc9483ee6b.jpg";"https://asset.product-live.com/a621ec8274cbe3b1f92382f710cdc7d3b5b42a44.JPG";"";"";"";"";"";"";"";"";"Créez une déco tendance digne des célèbres plateaux de cinéma avec ce lampadaire bicolore réalisé en métal et en bois. Vous apprécierez sa tête orientable ainsi que le parfait équilibre de son trépied. Pensez à le moduler pour l'adapter au mieux à vos besoins avant d'opter pour l'ampoule de votre choix, il sera incontestablement l'atout charme de votre déco ! Détail : Longueur de câble 2.20 m - Hauteur maximale du luminaire 1.50 m - Dimensions de l'abat jour 30x30 cm - Fonctionne avec une ampoule E27 10 W max non incluse.";"";"";
"LA12039";"3664944048626";"01/12/2020";"https://prodstoragevazc.blob.core.windows.net/import/7817a476c3fa440251b21bcdea155054ed5b467c/LA12039%20LA12040%20LA12041_IM_2018-07-10.docx";"https://asset.product-live.com/132d1069c5bd7e79f7c5b6272c3160673fdfb496.jpg";"https://asset.product-live.com/83e11fcabfbd597f736f9b95e2ff5c9335df5445.jpg";"https://asset.product-live.com/700100441d94e97acaf3861f8e4bd04ec92f24a6.jpg";"https://asset.product-live.com/fc28467d157f648dfe512f1848c1008f124532dd.jpg";"https://asset.product-live.com/72ff1a2256c31033daf702ddf8a3ba5f101f6f58.jpg";"";"https://asset.product-live.com/39b1a62e076f6fca0fa2827f373d4dd8fe76f28b.jpg";"https://asset.product-live.com/d647e27191568d45435df5a170986636cf6e41b2.jpg";"";"";"";"";"";"";"";"";"Modernisez votre intérieur avec cette suspension cinéma présentant une finition mate et un liseré doré ! Son style rétro offre un abat-jour design suspendu par un double câblage, votre intérieur sera tout simplement sublimé ! Détail : Ampoule E27 max 10 W non incluse - Alimentation sur secteur - Entrée : 220-240V AC ~ 50Hz - Longueur câble 1 m - Dimensions Abat-jour 30x30 cm - Composition Métal.";"";"";
"LA12040";"3664944048633";"01/12/2020";"https://prodstoragevazc.blob.core.windows.net/import/014a9155e393e6d1bce60d54f6c281b7a877fa7d/LA12039%20LA12040%20LA12041_IM_2018-07-10.docx";"https://asset.product-live.com/76b44241a03cd9f5c60a961d5ab547565ab3bae8.jpg";"https://asset.product-live.com/c7b5dd08bc95809f1b07d8cb3b02f1106a689a2e.jpg";"https://asset.product-live.com/7bfde467dc3a89da46f2aeabe1bf7fbf80344ad9.jpg";"https://asset.product-live.com/9b28a3e491a2b7f0c610a63824a63efb467c8912.jpg";"https://asset.product-live.com/29dc98738d552ca84d70641ab73a91e2ea3fd3f3.jpg";"";"https://asset.product-live.com/6ee51296bb60ccd456486d4d0e4402dc7a104786.jpg";"https://asset.product-live.com/e467165573196159b76db60c446a384778368663.jpg";"";"";"";"";"";"";"";"";"Modernisez votre intérieur avec cette suspension cinéma présentant une finition mate et un liseré doré ! Son style rétro offre un abat-jour design suspendu par un double câblage, votre intérieur sera tout simplement sublimé ! Détail : Ampoule E27 max non incluse - Alimentation sur secteur - Entrée : 220-240V AC ~ 50Hz - Longueur câble 1 m - Dimensions Abat-jour 30x30 cm - Composition Métal.";"";"";
"LA12041";"3664944048640";"30/11/2020";"https://prodstoragevazc.blob.core.windows.net/import/5b4afc7cab4a0ce9de943593e09384ef8bdebae9/LA12039%20LA12040%20LA12041_IM_2018-07-10.docx";"https://asset.product-live.com/1f797a38a32b085129cce73f2a3cf44a4785a10d.jpg";"https://asset.product-live.com/509fa46d66090f0434c346e03fe84195d993932d.jpg";"https://asset.product-live.com/18b13185d4f6e74ed887f7079e7b6023ad040a00.jpg";"https://asset.product-live.com/dd543cefb913d50c8c5c78914ac85501576b7070.jpg";"https://asset.product-live.com/dea8673de74df0b542a5ccc494ef9c7a6221411e.jpg";"";"https://asset.product-live.com/493858bdb91123a31f5f248baf0596e875b6f1d5.jpg";"https://asset.product-live.com/781f50734ac91333c0df6505c2f5bdfe61f6bde5.jpg";"";"";"";"";"";"";"";"";"Modernisez votre intérieur avec cette suspension cinéma présentant une finition mate et un liseré doré ! Son style rétro offre un abat-jour design suspendu par un double câblage, votre intérieur sera tout simplement sublimé ! Détail : Ampoule E27 max 10 W non incluse - Alimentation sur secteur - Entrée : 220-240V AC ~ 50Hz - Longueur câble 1 m - Dimensions Abat-jour 30x30 cm - Composition Métal.";"";"";
"LA12053";"3664944048763";"01/12/2020";"https://prodstoragevazc.blob.core.windows.net/import/c1f2d95c45071765dbbe9292835a58a87c01f6e4/LA12051_RAV%20LA12052_RAV%20LA12053_RAV_IM_2018-07-06.docx";"https://asset.product-live.com/df55a034535d67455803660d0112546760e9d0d7.jpg";"https://asset.product-live.com/7daf40936ed74c0f1420a4662226acc9a355207c.jpg";"https://asset.product-live.com/a0d7367b2c36b28f7b0a05d9c20236007df7976a.jpg";"https://asset.product-live.com/674462125e4c2869fc351582bba3eb2f6b3c656e.jpg";"https://asset.product-live.com/86fce49d2d9c302222f9b154e3616b21117991a1.jpg";"";"";"";"";"";"";"";"";"";"https://asset.product-live.com/c53149cae1e72882dec36618272068832a1dd4c1.png";"";"Vous aimez la tendance filaire ? Vous craquerez pour le charme de cette suspension boule offrant un design ultra-aérien ! Ce modèle trouvera incontestablement sa place au dessus d'une salle à manger ou au côté d'un canapé, succès garanti. Caractéristiques techniques : Dimensions 26x26 cm - Câble tressé  - Longueur de câble : 1.50 m - Fonctionne sur secteur - Entrée : 220-240V AC ~ 50/60Hz - Fonctionne avec une ampoule E27 40W max non fournie - Notice incluse - Système de fixation et pavillon inclus.";"";"";
"LA12056";"3664944048800";"01/12/2020";"https://prodstoragevazc.blob.core.windows.net/import/0d7c7d25231b6362f4367cebc295695da07a184e/LA12056_RAV_IM_2018-06-27%20-%20Copie.docx";"https://asset.product-live.com/53a85638e3c429b075bbd5d81c1e3220dda52fdd.jpg";"https://asset.product-live.com/0b8139acecde98f60cc93ce9b7a561375933383c.jpg";"https://asset.product-live.com/05ee8d807c4aa0ecdfe805179ccf4d1bbd6e8266.jpg";"https://asset.product-live.com/752146b05b0515ffe0b52db2e8439e367355955e.jpg";"https://asset.product-live.com/a4dba8578231d1ab32baf08f00200d32e133bf63.jpg";"";"https://asset.product-live.com/d940d2df28da75754aaf4223868fb50affdb5c54.jpg";"https://asset.product-live.com/096f99dd4ad76e069c60db1e3796d917009b4754.JPG";"";"";"";"";"";"";"https://asset.product-live.com/c4a7dc38473e22ed5d00b8cde038f7fc6aab6124.png";"";"Cette lampe à poser éclairera votre intérieur avec style. Son design métallique offre un beau socle effet marbre ainsi qu'un abat-jour perforé très tendance. Personnalisez-la avec l'ampoule de votre choix pour encore plus d'effet ! Détail : Ampoule E27 non incluse - Alimentation sur secteur - Entrée : 220-240V AC ~ 50Hz - Longueur câble 1.50 m - Dimensions 24x16x50 cm.";"";"";
"LA12057";"3664944048817";"01/12/2020";"https://prodstoragevazc.blob.core.windows.net/import/6577ccab02a44396cceb857f73300866e75f5a92/LA12057_RAV_IM_2018-06-27.docx";"https://asset.product-live.com/454e49d2bfa192e15921a8b82b1e1cf9dc36de09.jpg";"https://asset.product-live.com/0efa8bdfacf7b4eab0c06d3994a3d83372a4db1c.jpg";"https://asset.product-live.com/a5972607f940b1ca3035c541a165113be33a05c7.jpg";"https://asset.product-live.com/3f0dff3b259470983fbc7ac35b9e5e19233c98ba.jpg";"https://asset.product-live.com/9adcda50ae4ef3639f8c713dc93e3f9b4d30a1f7.jpg";"";"https://asset.product-live.com/8da325a9873523c95d57677a862fa74e338d579e.jpg";"https://asset.product-live.com/e191eece72223f2ed61bbfee772d9f8cf0dc1651.JPG";"";"";"";"";"";"";"https://asset.product-live.com/a5263d1724e0327e2cada57391f6e51c1df63cf3.png";"";"Egayez votre intérieur avec cette lampe de chevet à trépied ! Vous adorerez son look métallique ainsi que son abat-jour perforé. Personnalisez-la avec l'ampoule de votre choix pour encore plus d'effet ! Détail : Ampoule E27 max 10 W non incluse - Alimentation sur secteur - Entrée : 220-240V AC ~ 50Hz - Longueur câble 1.50 m - Dimensions 22x40 cm - Composition Métal.";"";"";
