"Code produit";"GENCOD_UVC";"DATE_MAJ_PL";"notice";"global";"situ";"situ02";"pack";"pack02";"temp";"visu";"visu02";"visu03";"visu04";"visu05";"visu06";"visu07";"visu08";"pngpack";"pngdisplay";"DESIGNATION_LONGUE_FR";"DESIGNATION_LONGUE_GB";"DESIGNATION_LONGUE_ES"
"KB5669";"3561865456694";"01/12/2020";"";"https://asset.product-live.com/0a957a356c4723704d872c9ec1867897eadcce49.jpg";"https://asset.product-live.com/f65ead6d0d6242543875736b1da7c9eddd4717dd.jpg";"";"https://asset.product-live.com/b57ea623564fe4de6676b45b44343e8bcc441c26.jpg";"";"";"https://asset.product-live.com/641cb9217b1163647e7ebf7ce4c9f67a66aa4b36.jpg";"";"";"";"";"";"";"";"https://asset.product-live.com/703ec5bcff8e68bdfe6f34fe46f6a41446a72b7f.png";"";"Ce carroussel à épices construit sur 2 étages présente 16 pots ronds en verre qui vous permettront de parfumer et de relever vos préparations culinaires en toute simplicité ! Remplissez-les et profitez de ce mécanisme tournant qui vous permettra de tout trouver rapidement. Détail : Système de fermeture à double clapets (verseur-saupoudreur).";"This spice rack carousel displays all the necessary items for adding more flavour to your cooking. Practical and revolving, the 16 glass jars do not take up a lot of space and are easily accessible.";"Este carrusel para especias tiene los elementos indispensables para aromatizar y realzar sus preparaciones culinarias. Práctico y giratorio, los 16 botes de vidrio incluidos ocupan poco espacio y son fácilmente accesibles.";
"KDO8509";"3561869385099";"01/12/2020";"";"https://asset.product-live.com/39aaa78e7992b07b53ef9f20a730b3401eaae96a.jpg";"https://asset.product-live.com/3b8f7bb245c575f5dc7b26012d8adcfcfeefea70.jpg";"";"https://asset.product-live.com/5161dfb054615c9894ed3937ec52268e62bef897.jpg";"";"";"https://asset.product-live.com/c97d904de815e5dcac980ca13286a8173bf6722a.jpg";"";"";"";"";"";"";"";"https://asset.product-live.com/cf35226ebe39454e27c872e08a8b6bab1bfab43c.png";"";"Organisez une mojito party à domicile et régalez les papilles de votre invité d'honneur grâce à ce coffret ultra complet qui vous donne accès aux accessoires indispensables pour un cocktail réussi! Vous aurez droit à 12 fiches recettes pour vous guider pas à pas, lancez-vous! Détail : 2 verres à mojito de 30 cl - 4 touilleurs - 6 pailles - 1 pilon en bois - 1 moule à glace pilée en silicone - 12 fiches recettes.";"With this mojito kit, you will have the taste of the Caribbean on your lips. It contains two 30cl glasses, 6 long straws, a wooden pestle, a special crushed ice silicone mould and 12 recipe cards. You have everything you need for a successful mojito, its fresh flavours will create happy memories.";"Con este kit para mojitos se sentirá como en el Caribe. Contiene dos vasos de 30 cl, 6 pajitas grandes, una maja de madera, un molde de silicona especial para hielo picado y 12 fichas de recetas. Todo lo necesario para hacer un buen mojito\; su frescor y sus sabores acidulados son una invitación a la relajación.";
"KV7030";"3561869670300";"01/12/2020";"";"https://asset.product-live.com/4953fb6667bbf02dfe6b1e9a4f191b50a2ebdfd1.jpg";"https://asset.product-live.com/bcfd781945f6a534a950080e16da9b088622bf39.jpg";"";"https://asset.product-live.com/09be0a3fe37c716ca7b7d930afcd13362e2b878b.jpg";"";"";"https://asset.product-live.com/dac91ea46a9964fd0aef9599780c9a0406014aef.jpg";"";"";"";"";"";"";"";"https://asset.product-live.com/4e79b7c78c9df9d46ac7b1057998ed6ecf374e6e.png";"";"Vous allez adorer cette carafe à décanter qui oxygène et tempère le vin avant toute dégustation. Elégante et pratique, elle révélera la subtilité des arômes de votre vin! Contenance : 1.5 L - Composition : Verre.";"";"";
"KV7079";"3561869670799";"30/11/2020";"";"https://asset.product-live.com/074d7f9c7612bb13a96b9f2d6f31a0710a8165a3.jpg";"https://asset.product-live.com/09b9209907ce4a44b8e44070a3e61996.jpg";"https://asset.product-live.com/3fffaf82740ff6f7a5fd74b0773a72dd305cb10a.jpg";"https://asset.product-live.com/3c60deee9da5ea1f76b2794df0f7ff100da623ab.jpg";"https://asset.product-live.com/f889966dfc756cc5aa49bc0e7c067f20fdf76089.jpg";"";"https://asset.product-live.com/c92523646641f14dcab8b6e479ad2d5a2475532d.jpg";"https://asset.product-live.com/3d070e05fc47b97962455f81b6d3a2ed92071214.jpg";"";"";"";"";"";"";"https://asset.product-live.com/7dd1f4bb3f4843878388bfd6fca13fa5.png";"";"Cette fontaine en verre est l'appareil idéal pour servir vos boissons chez vous ou en extérieur pendant vos déjeuners sur l'herbe. Ce modèle astucieux au design rétro est facile d'utilisation, il séduira à coup sûr vos convives ! Pensez à apporter une touche de déco à vos verres avant de les distribuer ! Dimensions de la fontaine montée sur son support : 39 cm - Diamètre : 20 cm. Contenance : 3.75 L.";"";"";
"MG2017";"3561864220173";"01/12/2020";"";"https://asset.product-live.com/769bfdaf81f0d678a989bb1d8b4091cf2b7e15a1.jpg";"https://asset.product-live.com/51476fa9bb3f418dd9305ec37396222dc9414f5c.jpg";"";"https://asset.product-live.com/ca614529e5f7c5f44554d32f0ba6d683146758ad.JPG";"";"";"https://asset.product-live.com/16c66c3e98f4d38864b68a1404e4a10185750ba9.jpg";"";"";"";"";"";"";"";"https://asset.product-live.com/19f036ecc2feb0ab3d2c94c3953f720a.png";"";"Finissez vos soirées entre amis à jouer au billard sur la table de la salle à manger ! Ce jeu de table convivial remportera un franc succès. Détail contenu : 1 billard - 2 queues + 16 boules - 1 triangle + 1 craie bleue - Notice et règles incluses - Dimensions : 51.6x31.7x9.9 cm.";"";"";
"MG2018";"3561864220180";"01/12/2020";"";"https://asset.product-live.com/3deb7244e77cc708a3ab0633c64b514339fd9e5f.jpg";"";"";"https://asset.product-live.com/220d09dea9f42b574fcf89b12c2ca0bab9f80ca1.JPG";"";"";"https://asset.product-live.com/38846b5acb537053f6b7de09c9d3309a5032565d.jpg";"";"";"";"";"";"";"";"https://asset.product-live.com/9cb46dc1c01d020002b606bc7abe70b5069052b7.png";"";"Finissez vos soirées entre amis à jouer au baby foot sur la table de la salle à manger ! Ce jeu de table convivial remportera un franc succès et vous pourrez organiser des tournois à domicile. Détail : Notice de montage incluse - Dimensions : 51x31x10 cm.";"";"";
"RG5806";"3561867558068";"20/11/2020";"";"https://asset.product-live.com/cf6eba1893a4caad3263f0cf5ce40f62914712c6.jpg";"https://asset.product-live.com/3dc4a87dab38aaa9dd6adcd2276986de1d3e3838.jpg";"";"https://asset.product-live.com/977f69384b9fa935bc3a1475ae45522d27161015.jpg";"";"";"https://asset.product-live.com/bb3b62966b6e2e5ef452d4ebd79ddb38a6afe158.jpg";"";"";"";"";"";"";"";"https://asset.product-live.com/be8cdcd49e8d57bf29b07e22cbcc33501650ce20.png";"";"Ce portant à double tringle sera ultra-pratique pour ranger rapidement vos vêtements ! Déplacez-le en un simple geste grâce à ses roulettes et profitez de 2 barres réglables qui vous permettront de suspendre aisément vos affaires. Dimensions : 82.3x46.7x166.3 cm.";"";"";
"RG5807";"3561867558075";"01/12/2020";"";"https://asset.product-live.com/75dc8e6411047a993b75481c04f17b0f3bca40ab.jpg";"https://asset.product-live.com/3df243b8ec9b4feea13233875073ace3ba5ca5bc.jpg";"";"https://asset.product-live.com/83bf41ac81c7788cf2be54e742df8f285f2c5d81.jpg";"";"";"https://asset.product-live.com/90372fc709c2ebf19ca224e7b77f36be9908bcc1.jpg";"";"";"";"";"";"";"";"https://asset.product-live.com/9828b0acbc55436282018c232fba4ba9.png";"";"Le valet de chambre est indispensable pour optimiser le rangement de vos vêtements du quotidien! Ce modèle peu encombrant offre une bonne stabilité avec son pied lesté, il sera parfait pour maintenir vos vêtements sans un pli et à portée de main! Détail : Notice de montage incluse - Hauteur : 109 cm - Composition : Métal.";"";"";
"RG5808";"3561867558082";"19/11/2020";"";"https://asset.product-live.com/8b3bc5a696126e14b64529a5391ffd0b777f8dba.jpg";"https://asset.product-live.com/795efdfea22ce4bbfc19003f1ed7d6531476e505.jpg";"";"https://asset.product-live.com/8c7a47bc295ab2969d7b72ed4fa6d32ec877c9ac.jpg";"";"";"https://asset.product-live.com/fbeaf94f900d6913b8946b5af1579874250c9dd6.jpg";"";"";"";"";"";"";"";"https://asset.product-live.com/131e8089242d023b06331f9a6085b88755b3633f.png";"";"Disposez cette étagère métallique au niveau des toilettes de la maison, vous gagnerez des espaces de rangement ! Le modèle est stable, il offre 3 niveaux de rangement. Hauteur : 152x26x59.3 cm.";"";"";
"RG5809";"3561867558099";"27/11/2020";"";"https://asset.product-live.com/b12c17f50c7326145fc3e8a6200c93aa2742b2ad.jpg";"";"";"https://asset.product-live.com/2080b4d1cc6b6360800a436024cdea3609a3cd3a.jpg";"";"";"https://asset.product-live.com/4e807f1418b8ff886223501660db4643d2109348.jpg";"https://asset.product-live.com/68165280f5bdf07b927dbb75e71c1c712789a4b6.jpg";"";"";"";"";"";"";"https://asset.product-live.com/003e159e1170b004f8a1263640558afeb7f3ab25.png";"";"Séchez votre linge en toute décontraction sur cet étendoir modulable selon vos besoins! Cette structure légère et compacte vous permet de bénéficier d'une grande capacité de séchage pouvant aller jusqu'à 16 mètres! Découvrez 3 niveaux et 2 porte-cintres. Détail : Système pliable - Notice de montage incluse - Dimensions ouvert : 138x59x165 cm - Composition : Métal.";"";"";
"KB5734";"3561865457349";"07/11/2020";"";"https://asset.product-live.com/2359ad20157862d1325e1f3fa4ca28c6f7010b92.jpg";"https://asset.product-live.com/19dfb256e906df976e2f5c23e58cb7cb8b381a17.jpg";"";"https://asset.product-live.com/33c95167be894ecaadd090c9681ab833.jpg";"";"";"https://asset.product-live.com/177a32307d39a5f68f9b9c97a08033851121f7b6.jpg";"https://asset.product-live.com/c603f21ecf3fe58a0ed8ce3df50c48c72707d234.jpg";"";"https://asset.product-live.com/1772a23353a9439df665b199d303735b23606f62.jpg";"";"";"";"";"https://asset.product-live.com/cb4345276aeacb7af13dc0aada00fa767ebf14fa.png";"";"Ce lot de 2 poubelles de cuisine présentant un design Bistrot tendance vous séduira à coup sûr! Testez leur robustesse ainsi qu'un système d'ouverture à pédale ultra pratique et silencieux! Contenance 27 L - 5 L.";"";"";
"KA1574";"3561869015743";"01/12/2020";"";"https://asset.product-live.com/1794e0520375c5fcecbc0ef147826c2be12e1c00.jpg";"https://asset.product-live.com/1455032920792974ed580cf4411e58775996ad16294d2.jpg";"";"https://asset.product-live.com/54e89dbd82dfeb800eed27245a30a92febd6b263.jpg";"";"";"https://asset.product-live.com/145503291463893a3cee0cf4411e58775996ad16294d2.jpg";"";"";"";"";"";"";"";"https://asset.product-live.com/afcf2137e67fa969954cb33f6a32106a7c69bf90.png";"";"Concoctez de délicieux cocktails maison dans ce bocal géant et faites en profiter toute la famille ! Service rapide et facile grâce à la louche prévue à cet effet ! Ajoutez le couvercle en bois si vous souhaitez conserver ou laisser reposer votre boisson ! Contenance : 5 L.";"Concoct delicious homemade cocktails in this giant drinks jar for all the family to enjoy! Quick and easy to serve with the ladle provided! Pop on the wooden lid if you want to store your drink, or allow it to rest! Capacity: 5L.";"Prepare deliciosos cócteles caseros en este tarro gigante y compártalos con toda la familia. Permite servir de forma rápida y sencilla gracias al cucharón incluido. Además, cuenta con una tapa de madera para conservar o dejar reposar las bebidas. Capacidad: 5 l.";
"HD3193";"3561864331930";"01/12/2020";"https://productlive.blob.core.windows.net/import/e473287bbb23a7b72a527a389b515084581cd91e/HD3193_HD3194_Licheng_Notice_2017%2004%2019.pdf";"https://asset.product-live.com/c1072a9993d811e3b8d954d3b83911b35a463780.jpg";"https://asset.product-live.com/dd13188639d654b8853b62768eb8e7ff1a5c6ff2.jpg";"";"";"";"";"https://asset.product-live.com/0c5bed25ffb22bbec8eb7a475ef2a026596d40ae.jpg";"https://asset.product-live.com/5d185dc1d0a5a7f91cd4983f9ebfa2ce7c73645b.JPG";"https://asset.product-live.com/b6d710181aeee1be815454c38fa6de67b62c578a.JPG";"";"";"";"";"";"";"";"Egayez votre séjour avec cette table d'appoint présentant un plateau circulaire coloré monté sur 4 beaux pieds en bois brut ! Ce modèle bicolore, épuré et élégant s'inspire fortement du design scandinave, il apportera beaucoup de cachet dans votre intérieur. Composition : Bois - Dimensions : 50.1x50.1x44.3 cm.";"Brighten up your living room with this side table featuring a coloured circular table top mounted on 4 beautiful natural wood legs! Sizes : 50.1x50.1x44.3 cm.";"";
"HD3194";"3561864331947";"01/12/2020";"https://productlive.blob.core.windows.net/import/6b6ca36ad77e8012ef7d51be19c2dc393b4c19a4/HD3205-HD3206-HD3193-HD3194_Notice_montage_preview.pdf";"https://asset.product-live.com/f71ee147dbdc3fdf9039a69a4a688b5acc8d2ac6.jpg";"https://asset.product-live.com/e5d5c067cffc46dd138929aec32a171d601f7b9b.jpg";"";"";"";"";"https://asset.product-live.com/82e813a18d2b7a21bca2bb97d7f92b44acc51252.jpg";"https://asset.product-live.com/6d49295caf07759360ab412f8a634fef3fabfa6c.JPG";"https://asset.product-live.com/5bddfb9344a041abb312395b00ae3fed861b8ebf.JPG";"";"";"";"";"";"";"";"Egayez votre séjour avec cette table d'appoint présentant un plateau circulaire coloré monté sur 4 beaux pieds en bois brut ! Ce modèle bicolore, épuré et élégant s'inspire fortement du design scandinave, il apportera beaucoup de cachet dans votre intérieur. Composition : Bois - Dimensions : 50.1x50.1x44.3 cm.";"Brighten up your living room with this side table featuring a coloured circular table top mounted on 4 beautiful natural wood legs! Sizes : 50.1x50.1x44.3 cm.";"";
"HD3071";"3561864330711";"30/11/2020";"https://productlive.blob.core.windows.net/import/ffaf696ffad5ef70a6be0a9678494d3e31d0503d/HD3070-71-72-73_NOTICE_2017%2008%2007.pdf";"https://asset.product-live.com/cbe847b171bdd2a98fb7fa7d6ad3d78d25214160.jpg";"https://asset.product-live.com/1474455210829a24aafd07fe911e69f6de7c2f643c1ac.jpg";"https://asset.product-live.com/b39cec410490b2fe88c60c312b7d432743659bfe.jpg";"";"";"";"https://asset.product-live.com/146012750098955bcb6d0fd9a11e59e49cd21ff48c47c.jpg";"";"";"https://asset.product-live.com/f37c6cf754f2e0002b5409d40eae498170a98474.jpg";"";"";"";"";"";"";"Laissez-vous séduire par le design épuré et résolument tendance de cette chaise d'inspiration scandinave. Son assise rembourrée ultra-confortable ainsi que ses pieds en bois brut vont vous faire craquer ! Dimensions : 46.2x52x86.4 cm - Hauteur d'assise : 41.5 cm - Poids maximum : 110 kg";"This chair, with a trendy yet simple design, will add a modern touch to your home. It has 4 natural wooden legs and an extremely comfortable padded seat that your guests will love as much as you! Dimensions: 82.5 x 51 x 48.1cm.";"Esta silla de diseño a la moda y depurado es ideal para dar un aire de modernidad a su hogar. El producto presenta 4 patas de madera en bruto así como un asiento con relleno ultraconfortable que le seducirán tanto a usted como a sus invitados. Dimensiones: 82,5x51x48,1 cm.";
"HD3072";"3561864330728";"01/12/2020";"https://productlive.blob.core.windows.net/import/df8e0be0a213a57a39882d88ef9f375985e86acb/HD3070-71-72-73_NOTICE_2017%2008%2007.pdf";"https://asset.product-live.com/d01762df2f9bf28bd5f522b311487c5e3d460f69.jpg";"https://asset.product-live.com/32f03afd7c200a62ebc7449187ce77756c0890fc.jpg";"https://asset.product-live.com/3a971cec1489cc6f0e1973e6be810ab46fea16a5.jpg";"";"";"";"https://asset.product-live.com/18bcfa9dab7b2b125cac99107859c4de00476b5d.jpg";"https://asset.product-live.com/f1e4ada46940b60b6c64d02151b4f5dcd458afa9.jpg";"https://asset.product-live.com/7e41e73972f468078b833c82c75a5d3191e611d3.jpg";"https://asset.product-live.com/5766ac635f61206bcb3600af73b6dfdc55f9dd9a.jpg";"https://asset.product-live.com/4b754db7aab73a6245840c95806abfa9c9fc9e04.jpg";"";"";"";"";"";"Laissez-vous séduire par le design épuré et résolument tendance de cette chaise d'inspiration scandinave. Son assise rembourrée ultra-confortable ainsi que ses pieds en bois brut vont vous faire craquer ! Dimensions : 46.2x52x86.4 cm - Hauteur d'assise : 41.5 cm - Poids maximum : 110 kg";"This chair, with a trendy yet simple design, will add a modern touch to your home. It has 4 natural wooden legs and an extremely comfortable padded seat that your guests will love as much as you! Dimensions: 82.5 x 51 x 48.1cm.";"Esta silla de diseño a la moda y depurado es ideal para dar un aire de modernidad a su hogar. El producto presenta 4 patas de madera en bruto así como un asiento con relleno ultraconfortable que le seducirán tanto a usted como a sus invitados. Dimensiones: 82,5x51x48,1 cm.";
"HD3073";"3561864330735";"01/12/2020";"https://productlive.blob.core.windows.net/import/2974206fc0a2137c0bbb96da6a70fcd7cf857945/HD3070-71-72-73_NOTICE_2017%2008%2007.pdf";"https://asset.product-live.com/6c3f50ce68c0b43805ac482e118e34c92a91205d.jpg";"https://asset.product-live.com/1474460861085ca1b54d07ff611e69f6de7c2f643c1ac.jpg";"https://asset.product-live.com/e22069928e066ef0946dcb7c570662f5e6702324.jpg";"";"";"";"https://asset.product-live.com/ba9f31cdfb4900bc3f9de5d385891463ed83d4f8.jpg";"https://asset.product-live.com/4a4a5e561bf298b43d2c77197451a695bf55865b.jpg";"https://asset.product-live.com/687a680df9b5f77870658dbc8950a0e9368572c2.jpg";"https://asset.product-live.com/2c80f8e87da12e576b893c0d3599dbd7470b50f4.jpg";"https://asset.product-live.com/88086dca7a5bb57d1509b492be50c6caae6cded9.jpg";"";"";"";"";"";"Laissez-vous séduire par le design épuré et résolument tendance de cette chaise d'inspiration scandinave. Son assise rembourrée ultra-confortable ainsi que ses pieds en bois brut vont vous faire craquer ! Dimensions : 46.2x52x86.4 cm - Hauteur d'assise : 41.5 cm - Poids maximum : 110 kg";"This chair, with a trendy yet simple design, will add a modern touch to your home. It has 4 natural wooden legs and an extremely comfortable padded seat that your guests will love as much as you! Dimensions: 82.5 x 51 x 48.1cm.";"Esta silla de diseño a la moda y depurado es ideal para dar un aire de modernidad a su hogar. El producto presenta 4 patas de madera en bruto así como un asiento con relleno ultraconfortable que le seducirán tanto a usted como a sus invitados. Dimensiones: 82,5x51x48,1 cm.";
"HD3074";"3561864330742";"01/12/2020";"https://productlive.blob.core.windows.net/import/6e587b71fb90cd6fb94b12fd4acfd430c966c3ff/HD3074_SHI_notice_2017-12-11_preview-02.jpg";"https://asset.product-live.com/a42b002fcad49e451bde122a53fce33c0eddec8c.jpg";"https://asset.product-live.com/75de816ec61dc92c9c178640604f1c9bf4fdc91c.jpg";"";"";"";"";"https://asset.product-live.com/b7be9e999fa6456d8c32c962aaf37286.jpg";"https://asset.product-live.com/b5afd529da33a7bd9f430fbe1b8330b94121f70b.jpg";"https://asset.product-live.com/a5cc1a0df193887001f4527622f030bb4d75be31.jpg";"https://asset.product-live.com/eafe5375131ae1bd15d74277a4ec8510d901db01.jpg";"";"";"";"";"https://asset.product-live.com/c484fd5533a82728dcacd088772ee3f121d804a2.png";"";"Laissez-vous séduire par le design épuré et résolument tendance de cette chaise d'inspiration scandinave. Sa coque rigide se marie à merveille à ses 4 beaux pieds en bois brut, vous allez l'adorer ! Dimensions : 46.2x52x86.4 cm - Hauteur d'assise : 41.5 cm.";"You will love the clean and trendy design of this Scandinavian chair! You will love the highly comfortable seat and 4 natural wooden legs! Dimensions: 86.4 x 52 x 46.2cm.";"Déjese seducir por el diseño depurado y a la moda de esta silla escandinava. Su confortable asiento así como sus 4 patas de madera en bruto le maravillarán. Dimensiones: 86,4x52x46,2 cm.";
"HD3075";"3561864330759";"01/12/2020";"https://productlive.blob.core.windows.net/import/bdb3e30368fb61027bb937dd1da7436b415f297f/HD3074_SHI_notice_2017-12-11_preview-02.jpg";"https://asset.product-live.com/6c985bdc013756723a3ef33f1d9841c890b5012f.jpg";"https://asset.product-live.com/8c73b108ac255c20845d49114e285fdb294ce559.jpg";"https://asset.product-live.com/5bdbff48c8adb5e8900acba95f0f602041e6b24a.jpg";"";"";"";"https://asset.product-live.com/7d9c793ff916577cb1ebe88e576d67713ad7aeca.jpg";"https://asset.product-live.com/1460128940417afb3ff10fd9d11e59e49cd21ff48c47c.jpg";"";"https://asset.product-live.com/08e72b64c36eb7239f4241c413f9cc075eed8756.jpg";"";"";"";"";"https://asset.product-live.com/8cd9147ebffb83752c69fc0cf67d10f7b902a28b.png";"";"Laissez-vous séduire par le design épuré et résolument tendance de cette chaise d'inspiration scandinave. Sa coque rigide se marie à merveille à ses 4 beaux pieds en bois brut, vous allez l'adorer ! Dimensions : 46.2x52x86.4 cm - Hauteur d'assise : 41.5 cm.";"You will love the clean and trendy design of this Scandinavian chair! You will love the highly comfortable seat and 4 natural wooden legs! Dimensions: 86.4 x 52 x 46.2cm.";"Déjese seducir por el diseño depurado y a la moda de esta silla escandinava. Su confortable asiento así como sus 4 patas de madera en bruto le maravillarán. Dimensiones: 86,4x52x46,2 cm.";
"HD3076";"3561864330766";"01/12/2020";"https://productlive.blob.core.windows.net/import/ea3bfbb003a9ab758c26139edb3f93f495451d48/HD3076_SHI_notice_2017-12-11_preview-02.jpg";"https://asset.product-live.com/cd09b5d16719f2b56aeded9ce3e2f9faa93bc588.jpg";"https://asset.product-live.com/a00964d80dc8987b3df387059183d5cadbbc0bcb.jpg";"";"";"";"";"https://asset.product-live.com/6b0dd8cfd8987436f806e3961f99909970e578e7.jpg";"https://asset.product-live.com/2b8ed7636aadf3962f58674aa83e042e4c3a31fb.jpg";"https://asset.product-live.com/694ba77f9f5971a753d40cd58a31afc59e87199e.jpg";"https://asset.product-live.com/292a577cdccc285d32a499aa78e2de27260cca43.jpg";"";"";"";"";"";"";"Laissez-vous séduire par le design épuré et résolument tendance de cette chaise d'inspiration scandinave. Sa coque rigide se marie à merveille à ses 4 beaux pieds en bois brut, vous allez l'adorer ! Dimensions : 46.2x52x86.4 cm - Hauteur d'assise : 41.5 cm.";"You will love the clean and trendy design of this Scandinavian chair! You will love the highly comfortable seat and 4 natural wooden legs! Dimensions: 86.4 x 52 x 46.2cm.";"Déjese seducir por el diseño depurado y a la moda de esta silla escandinava. Su confortable asiento así como sus 4 patas de madera en bruto le maravillarán. Dimensiones: 86,4x52x46,2 cm.";
"HD3077";"3561864330773";"01/12/2020";"https://productlive.blob.core.windows.net/import/d1406fb4ac2739861d8f9bcb35adac5a45552d83/HD3076_SHI_notice_2017-12-11_preview-02.jpg";"https://asset.product-live.com/95e9c0276e39a04b69aff30903e2794d995f54a0.jpg";"https://asset.product-live.com/c2953842745af099da83917e9bd3440a5f181c87.jpg";"";"";"";"";"https://asset.product-live.com/146013086033728108a12fda211e586f037c02ec3670f.jpg";"";"";"https://asset.product-live.com/001ac512d2728a8d3a14fb69f7ec680ccb85c173.jpg";"";"";"";"";"";"";"Laissez-vous séduire par le design épuré et résolument tendance de cette chaise d'inspiration scandinave. Sa coque rigide se marie à merveille à ses 4 beaux pieds en bois brut, vous allez l'adorer ! Dimensions : L54.1xH85.5xP46 cm - Hauteur d'assise : 47 cm.";"You will love the clean and trendy design of this Scandinavian chair! You will love the highly comfortable seat and 4 natural wooden legs! Dimensions: 86.4 x 52 x 46.2cm.";"Déjese seducir por el diseño depurado y a la moda de esta silla escandinava. Su confortable asiento así como sus 4 patas de madera en bruto le maravillarán. Dimensiones: 86,4x52x46,2 cm.";
"HD3078";"3561864330780";"20/11/2020";"https://productlive.blob.core.windows.net/import/2119cfe93fe4dd77eb8689882078b0f97444ceac/HD3076_SHI_notice_2017-12-11_preview-02.jpg";"https://asset.product-live.com/51e0fa304c968e22c7b3e6fa9ccfd66c80d39e33.jpg";"https://asset.product-live.com/f87d50656015c146000e145cc03b81e6887a9858.jpg";"";"";"";"";"https://asset.product-live.com/1460129169503383fbef2fd9e11e59e49cd21ff48c47c.jpg";"https://asset.product-live.com/6089ef78a506de43b28ee048acd861f3f68ed1d9.jpg";"https://asset.product-live.com/961f27c2963681e84545b66bdc2787b6df43aecc.jpg";"https://asset.product-live.com/8d6386f2313ddfbf6ad022dccde490476196e27a.jpg";"";"";"";"";"";"";"Laissez-vous séduire par le design épuré et résolument tendance de cette chaise d'inspiration scandinave. Sa coque rigide se marie à merveille à ses 4 beaux pieds en bois brut, vous allez l'adorer ! Dimensions : 46.2x52x86.4 cm - Hauteur d'assise : 41.5 cm.";"You will love the clean and trendy design of this Scandinavian chair! You will love the highly comfortable seat and 4 natural wooden legs! Dimensions: 86.4 x 52 x 46.2cm.";"Déjese seducir por el diseño depurado y a la moda de esta silla escandinava. Su confortable asiento así como sus 4 patas de madera en bruto le maravillarán. Dimensiones: 86,4x52x46,2 cm.";
